{
  "$schema": "https://json-schema.org/draft/2020-12/schema",
  "$id": "zenith.a2a.brief.v1",
  "title": "Agent to agent brief",
  "description": "What one agent hands another to start work. Extends the compaction-guard a2a envelope (schema, version, id, at, kind, status_code, from, to, subject, facts, actions, reply, refs) with acceptance_criteria and done_token. Owner rule 2026-10-16: 'agent to agent prose sucks, schemas with defined AC always'. Prose is for the owner only. Upgrade an older brief with bin/brief.sh migrate, never by hand.",
  "type": "object",
  "additionalProperties": false,
  "required": ["schema", "version", "id", "at", "kind", "status_code", "from", "to", "subject", "facts", "actions", "reply", "refs", "acceptance_criteria", "done_token", "output"],
  "properties": {
    "schema": {"const": "zenith.a2a.brief.v1"},
    "version": {"type": "string", "pattern": "^[0-9]+\\.[0-9]+\\.[0-9]+$", "description": "Version of the producer that wrote the brief."},
    "id": {"type": "string", "minLength": 1},
    "at": {"type": "string", "pattern": "^[0-9]{4}-[0-9]{2}-[0-9]{2}T[0-9]{2}:[0-9]{2}:[0-9]{2}Z$", "description": "UTC, always."},
    "kind": {"const": "request"},
    "status_code": {"type": "string", "pattern": "^A2A-[0-9]{3}$", "description": "A2A-001 brief issued, A2A-004 SOP breach. See README section Status codes."},
    "from": {"type": "object", "required": ["name", "role"], "properties": {"name": {"type": "string", "minLength": 1}, "role": {"type": ["string", "null"]}}},
    "to": {"type": "object", "required": ["name"], "properties": {"name": {"type": "string", "minLength": 1}, "role": {"type": ["string", "null"]}, "pane": {"type": ["string", "null"]}, "session": {"type": ["string", "null"]}}},
    "subject": {"type": "string", "minLength": 1},
    "work_order": {"type": "string", "pattern": "^WO-[0-9]{8}-[0-9a-f]{4}$", "description": "Ready work order a build seat starts from; brief-check BUILD=1 refuses a brief without one."},
    "facts": {"type": "object", "description": "Inventory, never narrative: owner words, rules, worktree, branch, reuse list."},
    "actions": {"type": "array", "minItems": 1, "items": {"type": "string", "minLength": 1}, "description": "What the receiver does, in order."},
    "reply": {"type": "object", "required": ["required", "format"], "properties": {"required": {"type": "boolean"}, "format": {"type": "string"}, "example": {"type": "string"}}},
    "refs": {"type": "array", "items": {"type": "string"}},
    "acceptance_criteria": {
      "type": "array",
      "minItems": 1,
      "items": {
        "type": "object",
        "additionalProperties": false,
        "required": ["id", "statement", "proof_kind", "proof"],
        "properties": {
          "id": {"type": "string", "pattern": "^AC[0-9]+$"},
          "statement": {"type": "string", "minLength": 1},
          "proof_kind": {"enum": ["command", "file", "url", "screenshot"]},
          "proof": {"type": "string", "minLength": 1, "description": "What ticks it: the command to run, the file to show, the url to cite, the screenshot to attach."}
        }
      }
    },
    "done_token": {"type": "string", "minLength": 1, "description": "The exact final line the receiver ends with."},
    "output": {
      "type": "object",
      "required": ["result_file"],
      "properties": {
        "result_file": {"type": "string", "minLength": 1, "description": "Where the receiver writes its result JSON, valid against zenith.a2a.result.v1."},
        "state_file": {"type": "string", "minLength": 1, "description": "JSONL file the seat appends one zenith.a2a.seat-state.v1 row to per step; the seat's resume point after a compaction."}
      }
    }
  }
}
